{
  "schemaVersion": 1,
  "id": "generated-shared-mcp",
  "kind": "generated-discovery",
  "source": "frostmi-fingerprint-generator",
  "licenseContext": "FrostMI-authored deterministic fixture.",
  "scan": {
    "home": "home",
    "project": "project"
  },
  "expected": {
    "agents": [
      { "normalizedName": "claude-code", "minCount": 1, "minConfidence": 50 },
      { "normalizedName": "codex-cli", "minCount": 1, "minConfidence": 60 }
    ],
    "mcpServers": [
      { "name": "shared-filesystem", "minCount": 2 }
    ],
    "skills": [],
    "contextFiles": [
      { "pathSuffix": "project/AGENTS.md" }
    ],
    "memoryAssets": [],
    "absentMCPServers": [],
    "permissionEvidenceMinCount": 0
  },
  "knownLimitations": []
}
